Zeitung;RP;Tagesspiegel;Welt;Spiegel;Zeit
;"Uwe40217 : Dieder Aufruf ist mehr als gerechtfertigt. Besonders gefällt mir die Bewertung des Genderns mit der Bemerkung ""...Mit Blick auf das angestrebte Ziel der Geschlechtergerechtigkeit sei es also dysfunktional..."". Das meint wohl kurz gesagt: das Gendern gehört in die Mülltonne sprachlicher Entgleisungen.";"MoiraGustafsson :  ich bin nicht einverstanden. es ist ja so, dass ein generisches maskulinum eben so dehnbar ist, dass
wir uns einen schwulen Schwarzen Mann im Rollstuhl
vorstellen können, eine Frau, oder gar eine lesbische, jüdische
Frau, eher nicht. darum ist es wichtig, zu
gendern. weil schwule Männer eher mitgemeint sind, als
 heterosexuelle (!) Frauen (um im bild dessen, was als norm wahrgenommen wird, zu bleiben) - und besser bezahlt. und der
vergleich mit großbritannien hinkt: die englische sprache kennt
keine weibliche form, das generische femininum verträgt hier
keine endung à la autor-in. das englische woman author ist eine
behelfsform. kein mensch kann mir erzählen, dass authoress
wirklich benutzt wird. (im gegensatz zu actress, okay, oder alte
formen wie mistress). und das englische ist im übrigen
auch androgendernd, denn niemand sieht sich in der pflicht, mit
male authour deutlich zu machen, dass es sich um einen mann
handelt, das ist eben nur bei tradiert weiblichen berufen der
fall. insofern ist der kommentar vom britischen professor
sexistisch. die verbesserung des schriftstellerkollegen im
übrigen auch, aber deswegen ist das ganze konzept des genderns nicht gleich obsolet, schließlich werden mit der *-form auch nicht-binäre identitäten kenntlich, also ""sicht""bar und ""hör""bar, gemacht...
und der vergleich mit der bundeskanzlerin hinkt. auch, wenn sie
seit einem jahrzehnt in diesem amt ist, ist bundeskanzler eine
männliche form und damit patriarchal, weil sie das männliche zur
norm erhebt. nur weil kinder oder jugendliche bewusst noch
keinen männlichen bundeskanzler kannten, heißt das nicht, dass
sie das wort allein qua seiner endung nicht als männlich
assoziert wahrnehmen, und damit die frau an der spitze im
kanzler*innenamt nicht als ausnahme. ";"D.logenes : Habe heute Mittag einen ""Dönenden"" gegessen.…";;
;;"-> jjano:     es ist ja so, dass ein generisches maskulinum eben so dehnbar ist, dass
    wir uns einen schwulen Schwarzen Mann im Rollstuhl
    vorstellen können, eine Frau, oder gar eine lesbische, jüdische
    Frau, eher nicht

Genau das ist das Problem, das im Artikel angesprochen wird. Das muss sich ändern. Das Gendern allerdings verhindert, dass sich das ändert (rot).

    vergleich mit großbritannien hinkt: die englische sprache kennt
    keine weibliche form, das generische femininum verträgt hier
    keine endung à la autor-in. 

Sorry, das ist einfach falsch. Natürlich gibt es im Englischen das Wort ""authoress"": https://www.dict.cc/?s=authoress (rot)
Allerdings gilt die Unterscheidung zwischen author und authoress inzwischen als veraltet. Stattdessen wird empfohlen, geschlechtsunabhängig die früher männliche Form einzusetzen. Aus Gründen, die im Artikel stehen.

    ﻿und der vergleich mit der bundeskanzlerin hinkt. auch, wenn sie
    seit einem jahrzehnt in diesem amt ist, ist bundeskanzler eine
    männliche form und damit patriarchal, weil sie das männliche zur
    norm erhebt. nur weil kinder oder jugendliche bewusst noch
    keinen männlichen bundeskanzler kannten, heißt das nicht, dass
    sie das wort allein qua seiner endung nicht als männlich
    assoziert wahrnehmen, und damit die frau an der spitze im
    kanzler*innenamt nicht als ausnahme. 

Auch das steht genau so im Artikel. Allerdings nutzt der Artikel den den Konjunktiv, um auf eine hypothetische Möglichkeit hinzudeuten: Wenn die Medienöffentlichkeit Angela Merkel all die Zeit als ""Bundeskanzler"" bezeichnet hätte, hätte das sehr wohl dazu geführt, dass Kinder und Jugendliche das Wort als geschlechtsneutral wahrnehmen würden (rot). Denkst du, Wortbedeutungen seien gottgegeben? Sie entstehen natürlich aus dem Sprachgebrauch. Und wenn der durch das Gendern zunehmend impliziert, das Wort ""Bürger"" würde nur Männer meinen, gilt auch irgendwann das Grundgesetz in der Wahrnehmung der Menschen nur noch für Männer (gelb).";;-> DerAndereBarde: Museum enthält bei Muttersprachlern einen Hiatus, keinen Glottisschlag. Spiegel und Ei sind Wörter, Ärzt und Innen nicht (rot/gelb). Ähnlich schluderig ist die ganze Argumentation der Befürworter(rot).;"Jan X. Kowalski : 

Wenn schon, denn schon... In einem Abwasch noch:

a) Die bestimmten Artikel der, die, das paritätisch zu je 1/3 neu zuteilen;
b) Unliebsame Substantive kleinschreiben;
c) Alle Fluchwörter gleichgeschaltet nur als * aufführen;
d) Das Wort ""verschlimmbessern"" ersatzlos streichen.
"
;MikeyM : Nun ja, trotz ARD: Immerhin hat die Frauschaft der Deutschinnen gestern Abend nicht gewonnen .. ;"Hane : Der wievielte Bundeskanzler ist Dr. Merkel?

    ﻿Im Grunde gibt es nur ein einzig wirklich gutes Argument gegen das Gendern: Es ist leider sexistisch.

Das für mich entscheidende Argument ist, dass wir eine generische Form brauchen. Immer, wenn wir eine Teil ins Verhältnis zur Gesamtheit setzen möchten, brauchen wir sie. Und immer, wenn wir gendern, geht das Verständnis für die generische Form ein Stückchen verloren.

Der Grundfehler des Sprachfeminismus ist es ja, einen Zusammenhang zwischen grammatikalischem und biologischem Geschlecht zu sehen. Grammatikalisch besteht zwischen Schriftsteller und Lichtschalter kein Unterschied. Wie kommt man auf die Idee, dass bei einem nur die Funktion benannt wird, beim anderen auch das biologische Geschlecht?

Wir sollten die irrtümlich angenommen Zusammenhang zwischen den grammatikalischen und biologischen Geschlechtern begegnen, indem wir sie unterschiedlich benennen.";Kerstin M. : Bleiben Sie bei sich! Melden Sie aktiv Widerstand an! Machen Sie es schlicht nicht mit! Einfach weiterhin viele viele Texte veröffentlichen, die frei von diesem linguistischen Blödsinn geschrieben sind! - Ich tue das konsequent und auch bewusst.;"Isi : Wer genau bestimmt, wie gesprochen und geschrieben wird?
...und was wird an den Schulen gelehrt ?";
;Winterwind: Sie freuen sich über seltsame Dinge.;;;-> 100tausend : Eine kleine Minderheit möchte dies unautorisiert für alle bestimmen (rot). Nach dem Motto: Wir sind ja schließlich die Guten.;"vorderwäldler : Das Deutsche ist eine viel zu schöne Sprache,um sie den Sprachpuristen zu überlassen.
Sprache hat immer was mit Bewegung ,Elastizität, Veränderung und Spieltrieb zu tun,und es schadet ihr am meisten,wenn man sie in Stein meisseln möchte.
Luther hat so viele deutsche Worte erschaffen,seither ist die Sprache eine Spielwiese.
Aber gendern ist streng verboten? Gehts noch?"
;"RP-READER-KR : Ich bin kein Freund des Genderns, weil es meiner Ansicht nach die gewohnte Flüssigkeit des Sprechens und Lesens nachteilig beeinflußt. Aus ideologischen Gründen dagegen zu wettern, halte ich aber für verfehlt. Es droht nicht der Untergang der deutschen Kultur, wenn wer die Sterneritis und Stricheritis auf sein Panier stickt, um zu ""beweisen"", daß er die Diversität der Geschlechter begriffen und deren Gleiberechtigung verinnerlicht hat. ";"liliancarla : identifiziert sich Nele Pollatschek dann auch nicht mit ""ihr""/""sie""? Gendern bietet doch genau die Möglichkeit  nicht zwei Genderidentitäten zu reduzieren. Es existieren auch Menschen, die nicht (genau) in dieses Zweigeschlechtermodell passen. Deshalb wird ja ""_"", "":"", ""·"" und ""*"" verwendet und
gesprochen wird eine kurze Pause, um alle die sich nicht mit ihrem
anatomischen Geschlecht identifizieren in die Sprache einzubeziehen.
Also eigentlich doch die perfekte Sprache, wenn Nele Pollatschek sich wünscht, dass ihr anatomisches Geschlecht kein Thema ist.";"Frank M. : Liebe Frau Hümpel,
Sie fragen, was noch kommen könnte und sprechen die Blau- und Rosatöne an, die in neuen Designs neutral gestaltet werden könnten.
Die Realsatire des Gender-Gaga hat Sie hier schon überholt:
Die Stadtverwaltung Erfurt schafft die blauen und rosafarbenen Puffbohne-Kuscheltiere für Neugeborene ab, die sie bisher auf den Entbindungsstationen kostenlos verteilt hat.
Über das neue Farbdesign, das ja jetzt gender-neutral sein soll, ist man noch in der Diskussion.
Hat was von Absurdistan.";"-> 8g32NBdKjZwrZMKXmMtoe6: In Frankreich gibt es eine Akademie, die bestimmt, was genau ""Französisch"" ist. In Deutschland kann das jeder so machen wie er will.
Möglichkeiten dagegen wären:
ironisches Überspitzen, sehr geehre Beamtinnen und Beamte und Beamteerale
absichtliches falsch verstehn. Ich bin kein Bürger innen, sonder ich bin außen, also bin ich nicht angesprochen.
besonders das Partizip missverstehen (rot) : in der Urkunde wurden Studierende angesprochen: weil ich viel lese, bin ich auch ein Studierender, ohne Student zu sein, also gelten Privilegien aus dieser Urkunde auch für mich (gelb).";"Ol’Nick : YMMD :) Ich werde mir das als köstliches Exempel für ""Haltet den Dieb!"" einrahmen."
;;"-> jjano: ""Sich mit einem Pronomen identifizieren"" funktioniert im deutschen nicht (rot). Pronomen haben im deutschen nichts mit dem Geschlecht eines Menschen zu tun, sondern mit dem Genus des Nomens, das ersetzt wird (gelb).

Ich habe noch nie von einem Mann gehört, dem der Penis abgefallen ist, weil er als Fachkraft einbestellt wurde. Trotzdem ist sein Pronomen als Fachkraft ""sie"". Ein Mädchen muss sich nicht mit dem Pronomen ""es"" identifizieren, trotzdem ist sein Pronomen in jedem Fall ""es"" (grün).

Nele Polatschek wünsch sich, dass ihr Geschlecht Privatsache ist. Das gleiche wünschen sich übrigens insbesondere viele nicht-binäre, und dazu haben sie auch das Recht (rot). Dazu gehört es eben auch, dass sie mit dem gleichen Bezeichnungen angeredet werden wie alle anderen, und dass man nicht, weil man nicht-binär ist, nicht über einen Asterisk, Doppelpunkt oder Unterstrich also solcher gebrandmarkt wird (gelb).";;Kommentar gelöscht;"fooke : An den Autor, bitte lesen und verstehen:
https://www.daad.org/files/2…"
;"-> Rp-oskar : ""... daß er die Diversität der Geschlechter begriffen und deren Gleiberechtigung verinnerlicht hat."" es gibt nur zwei Geschlechter. Alles andere ist Balla-balla (rot).";"Kwanna : Die Argumentation mit dem Englischen ist verführerisch, krankt aber an einem wesentlichen logischen Haken, der hier (bewusst?) ausgeklammert wurde: dem BESTIMMTEN ARTIKEL.

Das ist im Englischen neutral immmer ein ""the"", im Deutschen ist es ""der, die, das"".

Und wie würden wir dann auf deutsch verfahren wollen?
""Die Kanzler Merkel"", ""der Krankenschwester Michael""?

Schade, es hätte mich eigentlich überzeugt, das Englische. Aber es lässt sich zunächst mal nicht eins zu eins ins Deutsche übertragen.";"Frank M. : Die Gender-Befürworter haben diese ""logischen"" Zusammenhänge in ihrer Argumentation:
„Mit der Geschlechtsoption „divers“ ist ein “drittes Geschlecht“ offiziell anerkannt…Dem muss sich nun auch die Sprache anpassen“
Worüber sprechen diese Leute da eigentlich?
Es haben sich bis jetzt ca. 400 Menschen als divers eintragen lassen. Das sind 0,0005% der gesamten Bevölkerung.
Dafür wird nun der gesamte deutschsprachige Raum gegendert - absurd.
Womöglich hat von diesen 400 kein einziger Lust, sich im Sternchen wiederfinden zu müssen.
Hauptsache wir haben den Minderheiten Genüge getan, ob sie wollen oder nicht!";MaXLmustermann : Entschuldigung, ich glaube, Sie haben da etwas missverstanden.;
;;"-> silent: Sprache ist wandelbar. Das ist ja die ganze Idee hinter diesen Diskussionen: Wie ändert man die Sprache um inklusiver zu sein (rot).

Für den Vorschlag aus diesem Artikel könnte man zum Beispiel sagen ""Der Kanzler Merkel"" oder ""der Krankenpfleger Anna"" (gelb). Es ist so lange falsch bis man es ändert (rot).

Vielleicht gibt es ja auch noch andere Ansätze in diese Richtung :)";Veit G.: Meines Wissens ist in dem Urteil des BVG von 2017 nirgendwo von einem „dritten Geschlecht“ die Rede, sondern nur von „Varianten“ gegenüber einer männlichen oder weiblichen Geschlechtsentwicklung.;Kommentar gelöscht;"Max Michael : Ich muss bei diesen ideologisch aufgeladenen Genderdiskussionen immer an die vielen Studentinnen denken, die ich mit meinen (vor allem den kleineren) Lehrveranstaltungen auf Ihrem akademischen Weg ein Stück begleiten durfte.
Geistig hellwach, selbstbewusst, oft mit dem Willen beseelt, die Welt ein Stück aus den Angeln zu heben, schlicht und einfach Persönlichkeiten, welche schon jetzt ahnen lassen, wie sehr sie die Dinge ganz selbstverständlich verändern werden.
Die Intention der „Gendersprache“ ist edel und gut. Jedoch, so glaube ich, verkennt diese, dass jene jungen Frauen es fast als beleidigend empfinden, wenn versucht wird, sie mittels mehr oder weniger verordneter Sprache in den Status einer schützenswerten unterdrückten Minderheit zu setzen.
Ich bin mir sicher: Diese vielen jungen Frauen werden die Gesellschaft samt ihres Denkens und ihrer Wirklichkeit umfassend verändern. Wir denken in Sprache. Und diese Sprache wird sich ändern - in genau dem Sinne, der den Befürwortern der heutigen gendergerechten Konstruktionen so am Herzen liegt. Das Ganze wird wohl ohne Sternchen oder Binnen-I auskommen, ganz sicher aber wird es ohne ein wie auch immer geartetes Diktat stattfinden."
;Hallo : Die „sogenannte gendergerechte Sprache“ sei ideologisch motiviert, Stimmt! Es ist halt eine Ideologie und auch eine Höflichkeit, Frauen, wenn man sie meint, auch anzusprechen. ;"einliberaler : Nachsatz: Auch schön finde ich, dass z.B. in TV- Berichten zu den Corona- Demos vom Wochenende natürlich von Polizistinnen und Polizisten, aber dann eben nur von Reichsbürgern gesprochen wird. Dies und viele andere ähnlich gelagerte Sprechblasen legen nahe, dass natürlich nur positiv konnotierte Berufe, Tätigkeiten etc. gegendert werden, die negativ konnotierten jedoch selbstverständlich im generischen Maskulinum bleiben. Oder hat jemand in der Kriminalstatistik schon mal von ""Mörderinnen und Mördern"" gehört?";;"-> MaXLmustermann: Krankheitserreger ist kein generisches Maskulinum (rot), weil es bei Krankheitserregern kein Maskulinum / Femininum gibt. (gelb)

Aber wenn man von den ""Gründern"" spricht, oder von den ""Vätern des Grundgesetzes"", wird vergessen, dass mittlerweile auch Frauen beteiligt sind (rot). Die GLeichberechtigung war 1948-49 übrigens kein Selbstläufer (rot). Elisabeth Selbert hat als eine der Mütter des Grundgesetzes ähnlich dafür gekämpft wie die wenigen ""Gendernden"", die heute am liebsten mundtot gemacht werden von manchen (gelb). Oft Männer, die Angst vor Machtverlust haben, und sehr unsicher sind in ihrer gesellschaftlichen Rolle und Bedeutung (rot).";"-> fooke. Bis auf einen Satz stimme ich Ihnen voll und ganz zu, nur:
""Die Intention der „Gendersprache“ ist edel und gut."" habe ich inzwischen als das erkannt, was es ist: ein Versuch, sich unangreifbar zu machen (rot). Die Intention so mancher Ideologie war vielleicht in ihren Anfängen mal edel und gut, oft genug ist daraus dann eine brutale Diktatur geworden (rot(gelb)."
;klausmick: Quatsch.;;"-> Frank M.: @Veit G. 
Das ist richtig.
Die erwähnten Argumente der Befürworter habe ich mehrfach gelesen und gehört.
In dem Buch ""Richtig Gendern für Dummies"" kommt z.B. der Begriff ""drittes Geschlecht"" in diesem Zusammenhang vor.";Kommentar wurde vom Nutzer gelöscht;
;-> More84: Setzen sich doch mal mit unseren geltenden Rechtschreib- und Grammatikregeln (rot) auseinander. 'https://d.docs.live.net/0cd4392566bcd063/[Mappe 'https://d.docs.live.net/0cd4392566bcd063/[Mappe 2.xlsx]Tabelle1'!$A$16;"einliberaler : Ich finde es sehr interessant wieviele Worte es braucht, um über den Umweg des Englischen letztlich bei der Erkenntnis zu landen, dass die ganze Gederei nicht zielführend sei und dass z.B. mit dem generischen Maskulinum ""Bäcker"" doch tatsächlich auch schwule, schwarze, jüdische, ja sogar weibliche und von mir aus auch diverse diesen Beruf ausübende Menschen gemeint sein könnten (und es ja auch tatsächlich sind). 

Und noch interessanter finde ich, dass man offenbar mit gaaaanz viel Nachdenken, Sprechen und Schreiben über das Thema Gendern zu (pseudo-)wissenschaftlichem Ruhm und manchmal sogar zu Geld kommen kann.

Liegt bestimmt daran, dass ich (52, weiß, männlich) quasi das perfekte Feindbild bin bei dem Thema. ";"-> Jörg H.: Ja, auch mir geht schwer auf den Sack (rot), dass eine absolute Minderheit hier meint den öffentlichen Diskurs bestimmen zu müssen (gelb/rot)! 

Und, dass unsere inkompetenten Politiker sich hier auch noch vor den Karren spannen lassen (rot)! 

Früher hätte man solche Leute wahrscheinlich als Klassenclown bezeichnet und damit wäre es erledigt gewesen (rot)…";-> -> Elias-ZZKPaGU7R : Genau... Männer die Angst vor Machtverlust haben... Das ist wie so n Totschlagargument (rot). Die Gendernden sind diejenigen, die jeden Bezug zur Realität verloren haben und ein derart angeschlagenes Selbstvertrauen haben, dass sie alles anstößig finden, was ihrem Eho schadet (rot).;"Intellektueller Zugang : 

Ich möchte Befürworter wie Gegner der Gendersprache einladen, die Dinge einmal von meiner Warte aus zu sehen. Als schwuler Mann (42) gehöre ich zu jenen Gruppen, die durch den Genderstern sichtbar gemacht werden sollen. Das Problem ist nur: Ich möchte in dieser Form nicht sichtbar gemacht werden. Durch den Genderstern und seine Abwandlungen, fühle ich mich sexualisiert und markiert. Als würde mit dem Finger auf mich gezeigt. Meine Identität wird missbraucht, um sich auf der Seite der vermeintlich Guten zu platzieren. Das ist anmaßend und selbstsüchtig. Die Treiber der Sprachumwandlung erzeugen Unfrieden und beschwören Sprachprobleme herauf, die es in dem oft dargestellten Umfang nie gegeben hat.

Aufgrund meines vermeintlichen Andersseins habe ich Ausgrenzung, Schikane und Gewalt erlebt. Heute lebe ich gemeinsam mit meinem Mann ein zufriedenes und, wenn man so will, weitgehend „normales“ Leben. Folgende Generationen sollen es einmal einfacher haben. Der Kampf für Gleichheit ist und bleibt wichtig. Doch bitte nicht auf dem Rücken unserer Sprache! Sie ist auch mein persönlich wertvollstes Ausdrucksmittel. Durch Eingriffe wie das Gendern (und selbstverständlich auch den exzessiven Gebrauch englischer Vokabeln), verliert sie ihre Genauigkeit und poetische Kraft. Gendersprache wird dazu führen, dass viele Menschen gegenderte Inhalte und die Probleme der LGBT-Community nicht mehr ernst nehmen werden!
"
;;;bis hierhin 14;"-> 100tausend: Die Regel gibt es: alles Negative wird nicht gegendert (rot). Es gibt nur Täter, Kapitalisten, Vermieter etc. (gelb)
Ansonsten wird alles gegendert, z. B. Pferd:in und Bär:in.";
;fernblick : Schnee von gestern! In den Redaktionen hat man/frau längst ein neues Ziel aufs Panier geschrieben: die Grammatik-Reform ist längst im Gange.;"brezelberger : Zuerst Einmal vielen Dank für diesen ausführlichen Artikel, es freute mich sehr, einen guten Artikel zu diesem Thema zu lesen.

Vorab: Ich spare mir die Genderformen in meinem Kommentar, ich bitte darum, sich diese einfach dazu zu denken. Warum? später mehr!

Ich finde es gut, wenn auf die Diskriminierung gegenüber anderen Geschlechtern, insbesondere wenn es um Einschätzungen der Leistungen und Vergütungen geht. Meiner Meinung nach kann man nur aus dem Geschlecht, als welches jemand geboren wurde oder sich als dieses Identifiziert, nicht auf dessen Leistungen rückschließen - Es mag auch zB schwache Männer geben oder starke Frauen. 

Dem Ansatz des Gendern stehe ich dennoch seit es Stück für Stück vor einigen Jahren begann mit einigem Argwohn gegenüber. Es klingt im ersten Moment nach einer guten Idee, aber es zieht viele Probleme nach sich.

Eines dieser Probleme ist, wie sicher auch andere Leser und Kommentatoren angemerkt haben, sind viele Worte trotz der angehängten Femininen Endung ohne diese noch in der Maskulinen Form. Ein Beispiel: Der Verkäufer - Die Verkäuferin. Das IN wurde nur angehangen. Wird die maskuline Form entfernt, hätten wir Verkäufin. Das habe ich aber noch nirgends gesehen oder gehört.

Ein weiteres Problem, was mich persönlich auch betrifft, ist eine gewisse Unsicherheit beim Verfassen von Texten, insbesondere wenn man in einer Position ist, bei der nicht nur eine kleine Personengruppe den Text liest. Ich bin in einer Hochschule als Student organisiert, wir veranstalten oft Partys (immerhin bis Anfang diesen Jahres…) und abgesehen davon, dass viele unserer Einladungen mittlerweile zur Hälfte aus Genderformen bestehen, geht der Text oft durch mehrere Hände um wirklich jeden Fehler auszuschließen - ist was falsch (irgendwie ist das aber immer so) rennen ein paar Leute bei uns Sturm. Kann man machen, finde ich aber gerade bei einer Einladung vollkommen überzogen. Meine Meinung!";M.O: Besonders abturnend bei dem Versuch, künstlich eine diskriminierungsfreie Sprache anzuordnen, empfinde ich, dass genau diejenigen, die dafür plädieren, andererseits keinerlei Probleme mit Kopftuch, Burka, Kinderehe, Zwangsheirat haben. Da können Feministinnen aus und in arabischen und afrikanischen etc. Ländern noch so flehen. Hier wird dann von dieser gender-beflissenen Gruppe das patriarchal-hierarchische Menschenbild etlicher Zugewanderter als schützenswerte kulturelle Angelegenheit deklariert. Es geht den dahinterstehenden Parteien um kein respektvolles Miteinander, sondern gerade um Spaltung - das ist bequem und rechnet sich für sie.;bis hierhin 20 Kommis;"Petersbacher : 

Eigentlich ist das mit den Geschlechtern nur EIN Thema: Gerechtigkeit.

Das mit irgendwelchen Sprachregelungen hinzukriegen, ist m.Es der völlig falsche Weg.

Dass im Deutschen der männliche Begriff bei Unbestimmtheit gleichzeitig der sächliche ist (gibt sicher einen grammatikalischen Begriff dafür) ist eine Eigenheit - aber das sollte man mit einem kleiner Denkanstrengung doch wirklich zu bewältigen sein.

Natürlich meint ""der Pilot"" gleichzeitig ""die Pilotin"" und ""den Piloten"" - solange es allgemein den Menschen mit der Berufsbezeichnung betrifft.

Wer darin eine Benachteiligung oder eine Wertung sieht, ist m.Mn. nach wirklich auf dem Holzweg. Das ist kompletter Unsinn.

Und immer noch ist das - weitaus grössere- Problem, dass z.B. ein/e Intendant*In das zigfache verdient wie eine Kassenkraft. Die ""gender-pay-Lücke "" hat nix mit Gender zu tun, sondern mit den Klassenzugehörigkeiten und ausgeübtem Beruf. Weil wir Leistung nicht wirklich adäquat entlohnen, sondern nach Marktwert und Kaste.

Dass das die überbezahlte Intetendantin oder die Managerin oder Rechtsanwältibn oder oder oder nicht hören will, machts nicht weniger wahr - und auch nicht besser.
"
;;"-> brezelberger: Fortsetzung, aufgrund der Zeichenbeschränkung:

Letzter Punkt, eher als Konsument von Artikeln und Texten; die Gendersprache ist oft holprig und macht Texte künstlich länger aber oft auch schlechter lesbar (rot). Wie oben geschrieben, oft verzichte ich absichtlich auf das “Durchgendern” meiner Texte (grün/rot), ich möchte meinem Kommentar einen guten Redefluss geben und gehe davon aus, dass der geneigte Leser/die geneigte Leserin sich automatisch die für sich passende Form bilden kann (gelb). 

In anderen Ländern, wie im Artikel zB mit Großbritannien benannt, gibt es ein System was sofern ich es aus diesem Artikel verstanden habe, gut mit den maskulinen Formen funktioniert (gelb); warum halten wir uns also damit auf, unsere Sprache künstlich zu verkomplizieren und damit indirekt sogar sexistisch und diskriminierend zu machen anstatt eine einheitliche Form zu finden und wirklich an den Problemen wie Pay Gap zu arbeiten (rot)? ";-> Alois Hingerl: Ideologie kennt halt keine äußere Logik, nur eine innere (rot).;MomiMati: Die Feministinnen wollen heterosexuelle Männer sprachlich ausgrenzen. Laut Duden ist das falsch und muss im Diktat als Fehler angestrichen werden.;
